{
  "expected_output_contract_id": "EOC-SALES-005",
  "source_stage": "Product Discovery",
  "business_goal_id": "GOAL-SALES-005",
  "requirement_ids": ["REQ-SALES-005"],
  "expected_business_outcome": "Improve lead follow-up",
  "in_scope": [
    "Create task \"Follow up with customer\" for role Product Manager",
    "Notify Product Manager: High-score lead needs follow-up"
  ],
  "out_of_scope": [],
  "actors": ["Product Manager"],
  "data_entities": [],
  "business_rules": [],
  "acceptance_criteria": [
    "AC-REQ-SALES-005-1: Given score > 40, then task is created"
  ],
  "nfrs": {},
  "approved_by": "Pending",
  "status": "Approved for Design"
}
